CNES,NOME ESTABELECIMENTO,DS_TIPO_UNIDADE,LEITOS EXISTENTE,LEITOS SUS,COD_MUN
2519208,HOSPITAL ORTOPEDICO DE GOIANIA GERALDO PEDRA,HOSPITAL GERAL,81,35,5208707
2519216,HOSPITAL CEMEP,HOSPITAL ESPECIALIZADO,8,0,5208707
2519275,HOSPITAL DO CORACAO,HOSPITAL GERAL,63,0,5208707
2519283,CBCO,HOSPITAL GERAL,7,0,5208707
2519348,CLINICA AMPARHO,HOSPITAL GERAL,8,0,5208707
2519356,MATERNIDADE MODELO,HOSPITAL ESPECIALIZADO,25,0,5208707
2519429,HOSPITAL SANTA MONICA,HOSPITAL GERAL,15,12,5204508
2519445,HOSPITAL REGIONAL DE CRIXAS,HOSPITAL GERAL,19,15,5206404
2519496,HOSPITAL MODELO REGIONAL,HOSPITAL GERAL,35,0,5220207
2519526,HOSPITAL SANTA GENOVEVA,HOSPITAL GERAL,28,0,5217708
2519569,HOSPITAL MUNICIPAL NOSSA SRA DAS GRACAS RIALMA,HOSPITAL GERAL,25,25,5218607
2519593,HOSPITAL MUNICIPAL DE IPORA,HOSPITAL GERAL,33,33,5210208
2519879,HCA,HOSPITAL GERAL,49,13,2900702
2519887,CETRO,HOSPITAL ESPECIALIZADO,21,13,2900702
2519933,UMI,HOSPITAL ESPECIALIZADO,17,0,2900702
2520168,HOSPITAL DOCENTE ASSISTENCIAL CELIA ALMEIDA LIMA,HOSPITAL GERAL,35,35,2929206
2520311,AME,HOSPITAL GERAL,41,13,2928703
2520524,HOSPITAL MATERNO INFANTIL DE JUAZEIRO,HOSPITAL ESPECIALIZADO,82,82,2918407
2520583,HOSPITAL MUNICIPAL PROFESSOR JOSE MARIA DE MAGALHAES NETO,HOSPITAL GERAL,38,38,2929305
2520613,HOSPITAL NOSSA SENHORA DA POMPEIA,HOSPITAL GERAL,100,95,2929008
2521296,HOSPITAL BETHESDA,HOSPITAL GERAL,69,63,4209102
2521385,HOSPITAL DONA HELENA,HOSPITAL GERAL,190,1,4209102
2521431,CENTRO HOSPITALAR UNIMED,HOSPITAL GERAL,159,1,4209102
2521695,HOSPITAL RIO NEGRINHO,HOSPITAL GERAL,79,69,4215000
2521792,HOSPITAL E MATERNIDADE SAGRADA FAMILIA,HOSPITAL GERAL,88,57,4215802
2521873,HOSPITAL BEATRIZ RAMOS,HOSPITAL GERAL,103,100,4207502
2521881,ASSOCIACAO HOSPITALAR DE GUABIRUBA,HOSPITAL GERAL,16,13,4206306
2522101,HOSPITAL SANTA CATARINA,HOSPITAL GERAL,153,1,4202404
2522209,HOSPITAL MISERICORDIA,HOSPITAL GERAL,49,39,4202404
2522411,HOSPITAL AZAMBUJA,HOSPITAL GERAL,172,136,4202909
2522489,ASSOCIACAO HOSPITAL E MATERNIDADE DOM JOAQUIM,HOSPITAL GERAL,46,31,4202909
2522691,HOSPITAL E MATERNIDADE MARIETA KONDER BORNHAUSEN,HOSPITAL GERAL,375,316,4208203
2523051,HOSPITAL MUNICIPAL DE SAPEACU,HOSPITAL GERAL,28,28,2929602
2523132,HOSPITAL MUNICIPAL DE SAO GABRIEL,HOSPITAL GERAL,34,34,2929255
2523299,HOSPITAL MUNICIPAL WALTER LEAO ROCHA,HOSPITAL GERAL,20,20,2930006
2523310,HOSPITAL MATERNIDADE DR HEITOR SENTO SE,HOSPITAL GERAL,32,32,2930204
2523396,UNIDADE MISTA HOSPITAL MUNICIPAL SANTO ANTONIO,UNIDADE MISTA,25,25,2930402
2523515,HOSPITAL MUNICIPAL MARCUS ALLAN DE CASTRO ROCHA,HOSPITAL GERAL,24,24,2904001
2523779,HOSPITAL DR FRANCINO BORGES DOS REIS,HOSPITAL GERAL,13,13,2929750
2523787,HOSPITAL MUNICIPAL NOSSA SENHORA DA SAUDE,HOSPITAL GERAL,39,39,2929800
2524163,HOSPITAL MUNICIPAL MARIA AUXILIADORA DE CARVALHO TORRES,HOSPITAL GERAL,35,35,2930774
2524686,HOSPITAL JOAO CAMPOS,HOSPITAL GERAL,20,20,2931103
2524740,HOSPITAL MUNICIPAL DR IOMAR MEIRELES,HOSPITAL GERAL,26,26,2931202
2524805,HOSPITAL MUNICIPAL DR JOSE NERY,HOSPITAL GERAL,34,34,2931301
2524848,FUNDACAO HOSPITALAR DO MUNICIPIO DE TEOLANDIA,HOSPITAL GERAL,24,24,2931608
2524996,APMIU,HOSPITAL GERAL,71,71,2932101
2525062,HOSPITAL MUNICIPAL JONIVAL LUCAS,HOSPITAL GERAL,12,12,2930808
2525259,HOSPITAL MUNICIPAL DR JAIR BRAGA,HOSPITAL GERAL,24,24,2932002
2525453,HOSPITAL DR CESAR MONTEIRO PIRAJA,UNIDADE MISTA,39,39,2932309
2525461,UNIDADE DE SAUDE DE UMBURANAS,UNIDADE MISTA,5,5,2932457
2525569,HOSPITAL MANOEL NOVAES,HOSPITAL ESPECIALIZADO,170,130,2914802
2525658,HOSPITAL E MATERNIDADE ANA LUCIA MAGALHAES,HOSPITAL GERAL,13,13,2933257
2525933,HOSPITAL DR HEITOR GUEDES DE MELLO,HOSPITAL GERAL,121,112,2932903
2526042,HOSPITAL MUNICIPAL JOAO SALES RIOS,HOSPITAL GERAL,21,21,2933059
2526093,HOSPITAL PADRE ALFREDO HAASLER,HOSPITAL GERAL,20,20,2933158
2526239,HOSPITAL DR PANTALEAO SOARES DE MELLO,HOSPITAL GERAL,44,44,2933505
2526387,HOSPITAL MUNICIPAL DE MURITIBA,HOSPITAL GERAL,30,30,2922300
2526492,HOSPITAL EDMIR SOUZA COSTA,HOSPITAL GERAL,30,30,2922706
2526557,FUNDACAO HOSPITALAR DE ITACARE,HOSPITAL GERAL,32,32,2914901
2526638,SOPAI HOSPITAL INFANTIL,HOSPITAL GERAL,402,380,2304400
2526662,HOSPITAL MUNICIPAL JOAQUIM MANOEL OLIVEIRA,HOSPITAL GERAL,25,25,2311504
2526670,HOSPITAL MUNICIPAL FRANCISCO NOGUEIRA DE QUEIROZ,UNIDADE MISTA,9,9,2304277
2527057,CASA DE SAUDE E MATERNIDADE SAO RAIMUNDO,HOSPITAL GERAL,120,0,2304400
2527065,HOSPITAL MUNICIPAL JOAO MUNIZ,HOSPITAL GERAL,13,13,2310605
2527391,HOSP MATERN MADRE ROSA GATTORNO,HOSPITAL GERAL,44,34,2308302
2527413,HOSPITAL E MATERNIDADE REGIONAL SAO FRANCISCO,HOSPITAL GERAL,125,121,2302800
2527669,UNID MISTA RAIMUNDO PAIVA DIOGENES,UNIDADE MISTA,13,13,2311231
2527677,HOSPITAL MUNICIPAL SANTA ROSA DE LIMA,HOSPITAL GERAL,24,24,2306801
2527685,HOSPITAL MATERNIDADE SANTA RITA,HOSPITAL GERAL,36,36,2300705
2527693,CASA DE SAUDE MATERNIDADE CELESTINA COLARES,HOSPITAL GERAL,63,56,2313104
2527707,HOSPITAL SAO RAIMUNDO,HOSPITAL GERAL,102,102,2307601
2528282,HOSPISTAL MATERNIDADE DR LUIS DE GONZAGA DA FONSECA MOTA,HOSPITAL GERAL,31,31,2305209
2528681,CLINICA DE RECUPERACAO DE MUTILADOS,PRONTO SOCORRO ESPECIALIZADO,20,0,2304400
2528843,HOSPITAL DISTRITAL DR FERNANDES TAVORA,HOSPITAL GERAL,85,85,2304400
2529025,CASA DE SAUDE SAO GERARDO,HOSPITAL ESPECIALIZADO,60,0,2304400
2529068,HOSPITAL DISTRITAL GONZAGA MOTA JOSE WALTER,HOSPITAL ESPECIALIZADO,52,47,2304400
2529149,IJF INSTITUTO DR JOSE FROTA CENTRAL,HOSPITAL GERAL,635,591,2304400
2529319,PSA PRONTO SOCORRO DOS ACIDENTADOS,PRONTO SOCORRO ESPECIALIZADO,104,40,2304400
2529386,HOSPITAL MENINO JESUS,HOSPITAL GERAL,159,87,2304400
2529394,HOSPITAL PSIQUIATRICO SAO VICENTE DE PAULO,HOSPITAL ESPECIALIZADO,130,130,2304400
2529424,INSTITUICAO ESPIRITA NOSSO LAR,HOSPITAL ESPECIALIZADO,260,160,2304400
2529475,HOSPITAL INFANTIL DE FORTALEZA DRA LUCIA DE F R G S HIF,HOSPITAL ESPECIALIZADO,30,30,2304400
2529769,CLINICA NOSSA SENHORA DO ROSARIO LTDA,HOSPITAL GERAL,96,86,2109601
2529777,HOSPITAL MUNICIPAL ANTONIO MENDES JARDIM,HOSPITAL GERAL,17,17,2104206
2530031,HOSPITAL ADROALDO ALVES MATOS,HOSPITAL GERAL,36,36,2102002
2530236,HOSPITAL REGIONAL ADELIA MATOS FONSECA,HOSPITAL GERAL,73,73,2105401
2530473,HOSPITAL RUI BANDEIRA,HOSPITAL GERAL,48,44,2113009
2530805,HRO,HOSPITAL ESPECIALIZADO,2,0,2111300
2531208,INCOR SANTA MONICA,HOSPITAL GERAL,76,46,2105302
2531348,HOSPITAL SAO RAFAEL,HOSPITAL GERAL,117,54,2105302
2531771,HOSPITAL MUNICIPAL BOM JESUS DAS SELVAS,HOSPITAL GERAL,25,25,2102036
2531798,HOSPITAL REGIONAL DE ARAIOSES,HOSPITAL GERAL,86,86,2100907
2531801,HOSPITAL MUNICIPAL DR ANTENOR VIEIRA DE MORAES,HOSPITAL GERAL,37,37,2102101
2531836,HOSPITAL MUNICIPAL ANTONIO DA ROCHA MARTINS,HOSPITAL GERAL,28,28,2111722
2531933,CLINICA SAO SEBASTIAO LTDA,HOSPITAL GERAL,51,51,2107902
2532093,HOSPITAL MUNICIPAL MARIA HELENA FREIRE,UNIDADE MISTA,35,35,2110203
2532190,HOSPITAL MADRE REGINA PROTMANN,HOSPITAL GERAL,82,67,3204609
2532387,HOSPITAL MUNICIPAL DE SIMOES FILHO,HOSPITAL GERAL,59,59,2930709
2532522,HOSPITAL MUNICIPAL LUIZ EDUARDO MAGALHAES,HOSPITAL GERAL,46,46,2907806
2532549,HOSPITAL MUNICIPAL DILTON BISPO DE SANTANA,HOSPITAL GERAL,80,80,2910057
2532638,HOSPITAL E MATERNIDADE JOSEFA ISMAEL SOBRAL,HOSPITAL GERAL,22,22,2914604
2532751,HOSPITAL GERAL SAO PAULO,HOSPITAL GERAL,12,6,2914604
2532883,HOSPITAL MARIA AMELIA SANTOS,HOSPITAL GERAL,28,28,2933208
2532891,PROMATER DIAS DAVILA,HOSPITAL GERAL,32,0,2910057
2533057,HOSPITAL ANTENOR ALVES DA SILVA,HOSPITAL GERAL,50,50,2919801
2533162,HOSPITAL GERAL SANTA LUZIA,HOSPITAL GERAL,10,10,2914604
2533219,AMI,HOSPITAL GERAL,34,0,2914604
2533413,HOSPITAL MUNICIPAL DE JUCURUCU,HOSPITAL GERAL,25,25,2918456
2533480,HOSPITAL NAIR ALVES DE SOUZA,HOSPITAL GERAL,106,106,2924009
2534010,FUNDACAO HOSPITALAR DE SAUDE MUNICIPAL DE ITAUBA,HOSPITAL GERAL,16,16,5104559
2534231,MATERNIDADE JACARANDAS,HOSPITAL GERAL,36,0,5107909
2534444,HOSPITAL DE CANCER DE MATO GROSSO,HOSPITAL ESPECIALIZADO,99,73,5103403
2534460,HOSPITAL REGIONAL DR ANTONIO FONTES,HOSPITAL GERAL,112,102,5102504
2534517,HOSPITAL DR JOSE PEIXOTO DA SILVEIRA ITAPACI,HOSPITAL GERAL,43,43,5210901
2534525,HOSPITAL MUNICIPAL DR EURICO MARTINS,HOSPITAL GERAL,18,18,5205000
2534584,HOSPITAL MUNICIPAL IRMA FANY DURAN GOIANESIA,HOSPITAL GERAL,71,71,5208608
2534754,HOSPITAL NOSSA SENHORA DO ROSARIO,HOSPITAL GERAL,19,13,5217302
2534789,HOSPITAL MUNICIPAL SANTA EFIGENIA NIQUELANDIA,HOSPITAL GERAL,60,60,5214606
2534797,HOSPITAL MUNICIPAL DE HIDROLINA,HOSPITAL GERAL,28,28,5209804
2534835,HOSPITAL MUNICIPAL DE CRISTIANOPOLIS,HOSPITAL GERAL,8,8,5206305
2534886,HOSPITAL DAS CLINICAS NAZEOZENO,HOSPITAL GERAL,36,14,5206404
2534916,HOSPITAL MUNICIPAL DE ALVORADA DO NORTE,HOSPITAL GERAL,32,32,5200803
2534924,HOSPITAL MUNICIPAL DE MONTE ALEGRE DE GOAIS,HOSPITAL GERAL,16,16,5213509
2534932,HOSP MUN MALVINA HERCULANO SIZERVINSK COLINAS DO SUL GO,HOSPITAL GERAL,11,11,5205521
2534940,HOSPITAL MUNICIPAL DE IACIARA,HOSPITAL GERAL,16,16,5209903
2534967,HOSPITAL MUNICIPAL DE FORMOSA,HOSPITAL GERAL,60,60,5208004
2535130,HOSPITAL E MATERNIDADE SANTA CLARA JUSSARA,HOSPITAL GERAL,38,0,5212204
2535157,HOSPITAL MUNICIPAL DE ITAPURANGA,HOSPITAL GERAL,37,37,5211206
2535165,HOSPITAL MUNICIPAL DE MOZARLANDIA,HOSPITAL GERAL,21,21,5214002
2535181,HOSPITAL MUNICIPAL JOSE XAVIER DE CASTRO CACHOEIRA DOURADA,HOSPITAL GERAL,18,18,5204250
2535211,HOSPITAL MUNICIPAL NAZIR SEABRA GUIMARAES,HOSPITAL GERAL,16,16,5211602
2535238,HOSPITAL MUNICIPAL SANTA CLARA BOM JARDIM DE GOIAS,HOSPITAL GERAL,23,23,5203401
2535262,HOSPITAL DE QUEIMADURAS ANAPOLIS,HOSPITAL GERAL,34,0,5201108
2535270,HOSPITAL MUNICIPAL DE SANTA TEREZINHA DE GOIAS,HOSPITAL GERAL,38,38,5219704
2535327,HOSPITAL MUNICIPAL DE FLORES DE GOIAS,HOSPITAL GERAL,7,7,5207907
2535408,HOSPITAL SAO CAMILO TRINDADE,HOSPITAL GERAL,42,34,5221403
2535432,INSTITUTO SAO VICENTE DE PAULO HOSPITAL LUCIANO CHAVES,HOSPITAL GERAL,44,0,5208004
2535505,HOSPITAL DE OLHOS DO CENTRO OESTE HOCO,HOSPITAL ESPECIALIZADO,3,2,5208004
2535556,HOSPITAL DAS CLINICAS DR SERAFIM DE CARVALHO,HOSPITAL GERAL,99,99,5211909
2535637,HOSPITAL MATERNO INFANTIL DONA ZEBINA,HOSPITAL GERAL,13,13,5213756
2535742,HOSPITAL MUNICIPAL MILTON AMARO DO NASCIMENTO,HOSPITAL GERAL,12,12,5213004
2535785,HOSPITAL MUNICIPAL DORALICE G ROCHA TAQUARAL,HOSPITAL GERAL,25,25,5221007
2535939,HOSPITAL SAO COTTOLENGO,HOSPITAL ESPECIALIZADO,373,300,5221403
2535963,HOSPITAL MUNICIPAL DR CLARET,HOSPITAL GERAL,15,15,5202502
2536021,HOSPITAL MUNICIPAL SAO SEBASTIAO,HOSPITAL GERAL,17,17,5212105
2536048,HOSPITAL MUNICIPAL DR SERGIO NOBRE CAETANO DA COSTA,HOSPITAL GERAL,11,11,5220264
2536293,HOSPITAL MUNICIPAL DE CHAPADAO DO SUL,HOSPITAL GERAL,56,52,5002951
2536587,SOCIEDADE DE PROT MAT INFANCIA DE CAMAPUA,HOSPITAL GERAL,26,19,5002605
2536781,HOSPITAL E MATERNIDADE DE INOCENCIA,HOSPITAL GERAL,9,9,5004403
2536838,HOSPITAL SAO FRANCISCO DE ITAQUIRAI,HOSPITAL GERAL,28,15,5004601
2536862,HOSPITAL BENEFICENTE DR BEZERRA DE MENEZES,HOSPITAL GERAL,48,42,5005681
2536935,HOSPITAL 19 DE MARCO,HOSPITAL GERAL,16,16,5007109
2537028,HOSPITAL MUNICIPAL DE URUARA,HOSPITAL GERAL,58,58,1508159
2537044,CENTRO SOCIAL RURAL,UNIDADE MISTA,2,2,4101309
2537192,HOSPITAL E MATERNIDADE OASE,HOSPITAL GERAL,110,73,4218202
2537397,HOSPITAL UNIMED CHAPECO,HOSPITAL GERAL,97,0,4204202
2537788,HOSPITAL REGIONAL DO OESTE,HOSPITAL GERAL,288,234,4204202
2537826,HOSPITAL DE PINHALZINHO,HOSPITAL GERAL,43,28,4212908
2537850,HOSPITAL SANTO ANTONIO CAMPO ERE,HOSPITAL GERAL,44,29,4203501
2537958,HOSPITAL NOSSA SENHORA DA SAUDE CORONEL FREITAS,HOSPITAL GERAL,30,25,4204400
2538083,HOSPITAL CAIBI,HOSPITAL GERAL,28,20,4203105
2538148,HOSPITAL NOVA ERECHIM,HOSPITAL GERAL,34,28,4211405
2538180,HOSPITAL SAO JOSE DE MARAVILHA,HOSPITAL GERAL,93,75,4210506
2538229,HOSPITAL SAUDADES,HOSPITAL GERAL,34,30,4217303
2538342,HOSPITAL SAO BERNARDO,HOSPITAL GERAL,47,41,4214201
2538571,ASSOCIACAO HOSPITALAR PE JOAO BERTHIER,HOSPITAL GERAL,70,49,4216008
2540355,HOSPITAL SAO JOAO BATISTA HSJB,HOSPITAL GERAL,60,0,4204608
2543044,HOSPITAL DE CARIDADE SAO BRAZ,HOSPITAL GERAL,99,78,4213609
2543079,HOSPITAL MUNICIPAL SAO LUCAS,HOSPITAL GERAL,38,32,4210308
2543435,HOSPITAL SAO MIGUEL,HOSPITAL GERAL,23,0,4217204
2543443,CASA VITTA HOSPITAL,HOSPITAL GERAL,15,0,4217204
2545829,HOSPITAL E MATERNIDADE NOSSO SENHOR DOS PASSOS,HOSPITAL GERAL,31,31,2806701
2545918,UNIDADE MISTA DR BERNARDINO MITIDIERI,UNIDADE MISTA,18,18,2800670
2546000,UNIDADE DE PRONTO ATENDIMENTO 24 H PEDRO VALADARES,UNIDADE MISTA,2,2,2807105
2546027,HOSPITAL E MATERNIDADE SAO JOSE,HOSPITAL GERAL,85,71,2802908
2546124,HOSPITAL SAO LUIZ GONZAGA,HOSPITAL GERAL,25,25,2803005
2546671,HOSPITAL REGIONAL TERTULIANO C LUSTOSA DE ARAGUACU,HOSPITAL GERAL,28,28,1702000
2546736,HOSPITAL MUNICIPAL HERMINIO AZEVEDO SOARES,HOSPITAL GERAL,40,40,1708205
2546957,HOSPITAL ANTONIO BEZERRA DE FARIAS,HOSPITAL GERAL,83,79,3205200
2546973,HOSPITAL DR PEDRO FONTES,HOSPITAL GERAL,16,16,3201308
2547058,HOSPITAL METROPOLITANO S A,HOSPITAL GERAL,137,0,3205002
2547090,SANTA CASA DE MISERICORDIA JESUS MARIA JOSE,HOSPITAL GERAL,35,34,3203700
2547201,HPO HOSPITAL PADRE OLIVIO,HOSPITAL GERAL,30,27,3205036
2547317,HOSPITAL SAO JOSE,HOSPITAL GERAL,88,85,3204807
2547783,CENTRO DE ATENDIMENTO PSQUIATRICO DR ARISTIDES A CAMPOS,HOSPITAL ESPECIALIZADO,35,35,3201209
2547821,HECI HOSPITAL EVANGELICO DE CACHOEIRO DE ITAPEMIRIM,HOSPITAL GERAL,242,159,3201209
2548127,UNIMED SUL CAPIXABA COOPERATIVA DE TRABALHO MEDICO,HOSPITAL GERAL,86,0,3201209
2549182,HOSPITAL MUNICIPAL E MATERNIDADE AMALIA COUTINHO,HOSPITAL GERAL,60,60,2926400
2549263,HOSPITAL SAO VICENTE DE PAULA,HOSPITAL GERAL,43,43,4102901
2549328,HOSPITAL MUNICIPAL SANTA TEREZINHA,HOSPITAL GERAL,37,37,4106803
2549751,HOSPITAL PAULO FORTES,HOSPITAL GERAL,50,38,4125605
2549905,HOSPITAL PAULO AFONSO,HOSPITAL GERAL,48,48,2924009
2550032,HOSPITAL E MATERNIDADE NOSSA SENHORA APARECIDA,HOSPITAL GERAL,25,25,2928901
2550393,CENTRO DE SAUDE DR WALDIR PIRES,UNIDADE MISTA,8,8,2900306
2550407,CENTRO MEDICO SANTA CRUZ,HOSPITAL GERAL,31,31,2909406
2550555,HOSPITAL SANTA HELENA,HOSPITAL GERAL,79,20,2918001
2550679,HOSPITAL MUNICIPAL NOSSA SENHORA APARECIDA,HOSPITAL GERAL,26,26,5204102
2550687,HOSPITAL DR ROBERTO ARNIZAUT SILVARES,HOSPITAL GERAL,210,192,3204906
2550792,HOSPITAL EVANGELICO DE LONDRINA,HOSPITAL GERAL,366,152,4113700
2550881,FUNDACAO MEDICO SOCIAL RURAL DE SAO MARTINHO,HOSPITAL GERAL,16,15,4217105
2550938,HOSPITAL SANTO ANTONIO HSA,HOSPITAL GERAL,31,27,4201505
2550962,HOSPITAL DE CARIDADE DE JAGUARUNA,HOSPITAL GERAL,50,45,4208807
2551764,HOSPITAL REGIONAL RUI DE BARROS CORREIA,HOSPITAL GERAL,104,98,2601201
2551772,CENTRO ASSISTENCIAL DE SAUDE HORACIO RIBEIRO,UNIDADE MISTA,3,3,2208551
2551918,UNIDADE MISTA DE SAUDE DE AVELINO LOPES,UNIDADE MISTA,18,18,2201101
2551926,CLINICA SANTA FE LTDA,HOSPITAL ESPECIALIZADO,76,0,2211001
2552086,HOSPITAL MATERNIDADE SAO VICENTE DE PAULO,HOSPITAL GERAL,150,140,2306405
2552345,UNID MISTA DE BAIXIO,UNIDADE MISTA,19,19,2301802
2553066,HOSPITAL DE MODELO,HOSPITAL GERAL,32,28,4210902
2553155,HOSPITAL DA FUNDACAO,HOSPITAL GERAL,58,46,4216909
2553163,FUNDACAO MEDICA ASSISTENCIAL DO TRABALHADOR RURAL,HOSPITAL GERAL,28,25,4204103
2554011,HOSPITAL DE CARIDADE SAO PEDRO,HOSPITAL GERAL,39,33,4113908
2554097,HOSPITAL DE CARIDADE DONA DARCY VARGAS,HOSPITAL GERAL,56,52,4121505
2554429,HOSPITAL DE CARIDADE SAO FRANCISCO DE ASSIS,HOSPITAL GERAL,56,53,4122008
2554518,HOSPITAL SAO VICENTE FERRER,HOSPITAL GERAL,49,45,2307502
2554623,HOSPITAL MUNICIPAL DE JIJOCA DE JERICOACOARA,HOSPITAL GERAL,31,31,2307254
2554658,HOSPITAL MUNICIPAL DRA FRANCY FROTA,HOSPITAL GERAL,18,18,2305654
2554755,HOSPITAL MUNICIPAL DE CHOROZINHO,UNIDADE MISTA,12,12,2303956
2554771,HOSPITAL MATERNIDADE MARIA JOSE DOS SANTOS,HOSPITAL GERAL,26,26,2305704
2554798,HOSP MUNICIPAL DR ARGEU BRAGA HERBSTER,HOSPITAL GERAL,51,51,2307700
2555646,HOSPITAL REGIONAL DE SAO JOSE DRHOMERO MIRANDA GOMES,HOSPITAL GERAL,329,319,4216602
2555840,FUNDACAO HOSPITALAR SANTA OTILIA,HOSPITAL GERAL,52,33,4211702
2555956,HOSPITAL DE PEQUENO PORTE NOSSA SENHORA APARECIDA ANANAS,HOSPITAL GERAL,14,14,1701002
2556502,HOSPITAL DR JOSE RAMOS DE OLIVEIRA,HOSPITAL GERAL,80,0,2910727
2556510,HOSPITAL DAS CLINICAS DE EUNAPOLIS,HOSPITAL GERAL,29,18,2910727
2556847,HOSPITAL MUNICIPAL DE ITAMARAJU,HOSPITAL GERAL,85,85,2915601
2557088,HOSPITAL SANTO ANTONIO,HOSPITAL GERAL,24,24,2921807
2557118,HOSPITAL REGIONAL E MATERNIDADE SANTANA DE CAETITE,HOSPITAL GERAL,77,55,2905206
2557185,AAHTS,HOSPITAL GERAL,17,17,4127007
2557207,HOSPITAL NOSSA SENHORA DOS NAVEGANTES,HOSPITAL GERAL,12,12,4115705
2557509,PROMATRE DE JUAZEIRO,HOSPITAL GERAL,69,67,2918407
2557843,HOSPITAL SANTA MARIA LTDA,HOSPITAL GERAL,26,0,4219309
2557975,HOSPITAL SAO JORGE LTDA,HOSPITAL GERAL,46,43,4207809
2558017,HOSPITAL DE CARIDADE S B J DOS PASSOS,HOSPITAL GERAL,100,77,4209409
2558246,HOSPITAL SANTA ISABEL,HOSPITAL GERAL,301,193,4202404
2558254,HOSPITAL SANTO ANTONIO,HOSPITAL GERAL,237,194,4202404
2558262,HOSPITAL MUNICIPAL FRANCISCA ORTEGA,HOSPITAL GERAL,20,20,5006002
2558289,HOSPITAL MARECHAL RONDON,HOSPITAL GERAL,43,27,5005004
2558300,HOSPITAL E MATERNIDADE SANTA LUZIA,HOSPITAL GERAL,10,10,5001243
2558327,HOSPITAL MUNICIPAL DE SETE QUEDAS,HOSPITAL GERAL,18,18,5007703
2558351,HOSPITAL MUNICIPAL MARIA DOS SANTOS BASTOS,HOSPITAL GERAL,5,5,5008404
2558408,HOSPITAL SANTA CATARINA,HOSPITAL GERAL,21,19,5005103
2558416,CASA DE SAUDE DIVINA PROVIDENCIA,HOSPITAL GERAL,28,0,5000609
2558580,HOSPITAL MUNICIPAL CRISTO REI,HOSPITAL GERAL,12,12,5003454
2558610,HOSPITAL DA SIAS,HOSPITAL GERAL,67,57,5003801
2559188,HOSPITAL SAO JOAO BATISTA,HOSPITAL GERAL,12,12,4118709
2560070,HOSPITAL SAO LUCAS,HOSPITAL GERAL,21,21,2415008
2560089,HOSPITAL REGIONAL MONSENHOR ANTONIO BARROS,HOSPITAL ESPECIALIZADO,68,58,2412203
2560240,HOSPITAL MUNICIPAL TIA JUNIETA,HOSPITAL GERAL,25,25,1716208
2560771,HOSPITAL UNIVERSITARIO SANTA TEREZINHA,HOSPITAL GERAL,179,142,4209003
2560828,HOSP MATERN SAO JOSE MAURITI,HOSPITAL ESPECIALIZADO,72,72,2308104
2560836,HOSP MUNIC ANTONIO NERY FILHO,PRONTO SOCORRO GERAL,27,27,2313807
2560852,HOSPITAL MATERNIDADE MADALENA NUNES,HOSPITAL GERAL,129,129,2313401
2560976,HOSPITAL MATERNIDADE NOSSA SENHORA DA EXPECTACAO,HOSPITAL GERAL,24,24,2307007
2560984,HOSPITAL MUNICIPAL JAIME OSTERNO,HOSPITAL GERAL,34,34,2307809
2560992,HOSP NOSSA SRA DO PATROCINIO,HOSPITAL GERAL,30,30,2300408
2561018,UNID MISTA DE SABOEIRO,UNIDADE MISTA,38,38,2311900
2561026,HOSP MUNIC DR CICERO F FILHO,HOSPITAL GERAL,45,44,2310308
2561034,HOSPITAL E MATERNIDADE NOSSA SENHORA DE NAZARE,HOSPITAL GERAL,14,14,2302909
2561042,HOSPITAL MUNICIPAL MARIA IDALINA RODRIGUES DE MEDEIROS,HOSPITAL GERAL,14,14,2305357
2561050,HOSPITAL MUNICIPAL DE CATUNDA,HOSPITAL GERAL,23,23,2303659
2561069,HOSPITAL CHAGAS BARRETO,HOSPITAL GERAL,20,20,2308203
2561298,UNID MISTA NOSSA SRA AUXILIADORA,UNIDADE MISTA,16,16,2303402
2561328,HOSPITAL MUNICIPAL FRANCISCA BELARMINO DA COSTA,HOSPITAL GERAL,24,24,2313609
2561336,HOSPITAL MUNICIPAL MARIA WANDERLENE NEGREIROS DE QUEIROZ,HOSPITAL GERAL,36,36,2305308
2561344,HOSPITAL MATERNIDADE SAO JOSE,HOSPITAL GERAL,40,40,2305001
2561352,HOSPITAL MUNICIPAL MONSENHOR ANTONINO,HOSPITAL GERAL,37,37,2304236
2561395,HOSP GERAL MANUEL ASSUNCAO PIRES,HOSPITAL GERAL,40,40,2301000
2561409,HPP HOSPITAL DE PEQUENO PORTE DE PIQUET CARNEIRO,UNIDADE MISTA,18,18,2310902
2561417,HOSPITAL SAO JOSE DE DOENCAS INFECCIOSAS,HOSPITAL GERAL,134,134,2304400
2561425,HOSP MATERN MUNICIPAL,HOSPITAL GERAL,69,69,2314102
2561433,HOSPITAL E MAT VENANCIO RAIM DE SOUSA,HOSPITAL GERAL,48,48,2305233
2561441,HOSPITAL E MATERNIDADE FRANCISCO RAIMUNDO MARCOS,HOSPITAL GERAL,24,23,2309458
2561468,HOSP DR THADEU DE PAULO BRITO,HOSPITAL GERAL,19,19,2303303
2561484,HOSPITAL DE OLHOS NEUSA ROCHA,HOSPITAL ESPECIALIZADO,2,0,2304400
2561492,HOSPITAL UNIVERSITARIO WALTER CANTIDIO,HOSPITAL GERAL,201,201,2304400
2561891,HOSP MUNIC DE PARAIPABA,HOSPITAL GERAL,25,25,2310258
2562138,HOSP MATERN REG VALE DO CURU,HOSPITAL GERAL,51,51,2310704
2562146,HOSPITAL DE PEQUENO PORTE ROQUE SILVA MOTA,UNIDADE MISTA,16,16,2313351
2562154,HOSP MATERN JOAO FERREIRA GOMES,HOSPITAL GERAL,34,34,2306306
2562162,HOSPITAL MUNICIPAL CARLOS GUALBERTO DE SALES,UNIDADE MISTA,13,13,2313757
2562200,HOSPITAL MUNICIPAL ANTONIO RIBEIRO DA SILVA,HOSPITAL GERAL,20,20,2312601
2562227,HOSP MATERN JULIA JORGE,HOSPITAL GERAL,13,13,2304608
2562316,HOSP MUN ABELARDO GADELHA DA ROCHA,HOSPITAL GERAL,113,113,2303709
2562391,SANTA CASA DE PARACURU,HOSPITAL GERAL,42,40,2310209
2562472,PRONTOCLINICA DE FORTALEZA,HOSPITAL ESPECIALIZADO,28,14,2304400
2562480,OFTALMED CENTRO DE OFTALMOLOGIA,HOSPITAL ESPECIALIZADO,4,0,2304400
2562499,HOSPITAL MATERNIDADE SAO LUCAS,HOSPITAL GERAL,128,126,2307304
2562545,HOSP MATERNIDADE SANTA TEREZINHA,HOSPITAL GERAL,52,52,2303709
2562685,CASA DE SAUDE NOSSA SENHORA DAS GRACAS,HOSPITAL GERAL,36,0,2304400
2562871,HOSPITAL SAO RAIMUNDO,HOSPITAL GERAL,61,57,2314003
2563347,HOSPITAL ANTONIO ROSENO DE MATOS,HOSPITAL GERAL,16,16,2300804
2563355,HOSP MATERN SENHORA SANTANA,UNIDADE MISTA,21,21,2312106
2563363,HOSPITAL DE PEQUENO PORTE ANA ALENCAR ALVES,UNIDADE MISTA,20,20,2309201
2563460,HOSP MUNIC DONA MARIA MUNIZ,HOSPITAL GERAL,56,56,2304251
2563479,HOSPITAL MUNICIPAL DE MORRINHOS,HOSPITAL GERAL,21,21,2308906
2563487,HOSPITAL MUNICIPAL DE BELA CRUZ,HOSPITAL GERAL,32,32,2302305
2563681,HIAS HOSPITAL INFANTIL ALBERT SABIN,HOSPITAL ESPECIALIZADO,371,357,2304400
2564211,HOSPITAL MATERNIDADE SAO VICENTE DE PAULO,HOSPITAL GERAL,232,191,2301901
2564238,HOSPITAL MATERNIDADE SANTO ANTONIO HMSA,HOSPITAL GERAL,141,108,2301901
2564580,UNID MISTA NOSSA SRA DAS ANGUSTIAS,UNIDADE MISTA,16,16,2313252
2564769,HOSPITAL E CENTRO DE PARTO NORMAL DE PINDORETAMA,HOSPITAL GERAL,14,14,2310852
2566168,HOSPITAL MATERNO INFANTIL N SRA DE NAZARETH,HOSPITAL ESPECIALIZADO,295,291,1400100
2566893,HOSPITAL AMERICO CAETANO DO AMARAL,HOSPITAL GERAL,18,18,4202503
2567466,HOSPITAL MUNICIPAL SAO JUDAS TADEU DE TERRA BOA,HOSPITAL GERAL,32,32,4127205
2568292,CLINICA MEDICA SAO CAMILO,HOSPITAL ESPECIALIZADO,126,33,4128203
2568349,HOSPITAL REGIONAL DE CARIDADE NOSSA SRA APARECIDA,HOSPITAL GERAL,62,50,4128203
2568373,ASSOCIACAO DE PROTECAO A MATERNIDADE E A INFANCIA,HOSPITAL GERAL,99,61,4128203
2568586,UNIDADE MISTA SANTO ANTONIO DO PARAISO,UNIDADE MISTA,6,6,4124301
2568713,HOSPITAL REGIONAL ALTO VALE,HOSPITAL GERAL,193,150,4214805
2568926,HOSPITAL SANTA TEREZINHA,HOSPITAL GERAL,16,14,4117008
2569213,HOSPITAL CONCORDIA,HOSPITAL GERAL,59,56,3204559
2569531,HOSPITAL CRISTO REDENTOR,HOSPITAL GERAL,19,0,5100250
2569671,HOSPITAL MUNICIPAL JOSE INOCENCIO DE OLIVEIRA DE MARA ROSA,HOSPITAL GERAL,18,18,5212808
2569701,HOSPITAL MUNICIPAL DE SAO DOMINGOS,HOSPITAL GERAL,22,22,5219803
2569728,HOSPITAL MUNICIPAL DE CIDADE OCIDENTAL,HOSPITAL GERAL,20,20,5205497
2569760,HOSPITAL MUNICIPAL DR CARLOS MAGNO DA NOBREGA,HOSPITAL GERAL,25,25,5207402
2569841,HOSPITAL MUNICIPAL DE ITAGUARU,HOSPITAL GERAL,19,19,5210604
2570076,HOSPITAL E MATERNIDADE SANTA LUZIA GOIANESIA,HOSPITAL GERAL,33,14,5208608
2570084,HOSPITAL DE TRINDADE,HOSPITAL GERAL,44,24,5221403
2570092,HOSPITAL SAO SEBASTIAO ITABERAI,HOSPITAL GERAL,38,0,5210406
2570300,HOSPITAL NOSSA SENHORA APARECIDA VALPARAISO,HOSPITAL GERAL,26,0,5221858
2570378,HOSPITAL NOSSA SENHORA DE FATIMA,HOSPITAL GERAL,34,25,5213103
2570394,CLINICA KITICE,HOSPITAL GERAL,3,0,5206206
2570416,HOSPITAL E MATERNIDADE MUNICIPAL ENF MARIA HELENA SANTOS,HOSPITAL GERAL,17,17,5221502
2570424,HOSPITAL MUNICIPAL SAO SEBASTIAO DE MAIRIPOTABA,HOSPITAL GERAL,13,13,5212600
2570777,ASSIST MED HOSPITALAR,HOSPITAL GERAL,75,64,5220454
2570823,HOSPITAL E MATERNIDADE NOSSA SENHORA APARECIDA LTDA,HOSPITAL GERAL,67,15,5204508
2571072,HOSPITAL SAO LUCAS,HOSPITAL GERAL,35,22,5213103
2571080,HOSPITAL EVANGELICO DE ACREUNA,HOSPITAL GERAL,30,0,5200134
2571099,CLINICA PAPI IPAMERI,PRONTO SOCORRO ESPECIALIZADO,2,0,5210109
2571218,HOSPITAL MUNICIPAL MAE ROBERTA,HOSPITAL GERAL,24,24,5208301
2571242,HOSPITAL DAS CLINICAS DR NEVES,HOSPITAL GERAL,27,15,5213103
2571439,HOSPITAL MUNICIPAL ANTONIO CARVALHO SANTA FE DE GOIAS,HOSPITAL GERAL,17,17,5219258
2571714,HOSPITAL MUNICIPAL DR KURIQUI CANAME,HOSPITAL GERAL,29,29,4103206
2571811,HOSPITAL NOSSA SENHORA APARECIDA,HOSPITAL GERAL,35,33,4104600
2571978,HOSPITAL MUNICIPAL FELICITA SANSON ARROSI,HOSPITAL GERAL,34,34,4109757
2572192,HOSPITAL BOM SAMARITANO,HOSPITAL GERAL,36,28,4105300
2572257,HOSPITAL MUNICIPAL DE LINDOESTE,HOSPITAL GERAL,20,20,4113452
2572265,HOSPITAL MUNICIPAL BOM JESUS,HOSPITAL GERAL,21,21,4115507
2572370,INSTITUTO SANTA ISABEL ISI,HOSPITAL GERAL,38,31,4108205
2572443,HOSPITAL SANTO ANTONIO,HOSPITAL GERAL,51,44,4109302
2572818,HOSPITAL MUNICIPAL DR AURI ANTONIO SANSON,HOSPITAL GERAL,39,39,4120903
2573032,APMI,HOSPITAL GERAL,27,26,4128559
2573075,HOSPITAL NOSSA SENHORA DE FATIMA,HOSPITAL GERAL,30,22,4109302
2573172,HOSPITAL DR AURELIO,HOSPITAL GERAL,49,40,4116703
2573318,HOSPITAL MUNICIPAL VICTOR DE SOUZA PINTO,HOSPITAL GERAL,26,26,4108700
2573415,HOSPITAL MUNICIPAL SAO LUCAS,HOSPITAL GERAL,23,23,4113106
2573423,HOSPITAL MUNICIPAL DE BORRAZOPOLIS,HOSPITAL GERAL,27,27,4103305
2573466,SANTA CASA DE MISERICORDIA MARIA SANTISSIMA,HOSPITAL GERAL,26,24,4125803
2573504,HOSPITAL REGIONAL DO VALE DO IVAI,HOSPITAL ESPECIALIZADO,304,296,4112108
2575957,HOSPITAL NOSSA SENHORA DE FATIMA,HOSPITAL GERAL,29,25,4116059
2576171,HOSPITAL SANTA RITA,HOSPITAL GERAL,29,0,4101507
2576198,IRMANDADE SANTA CASA DE ARAPONGAS,HOSPITAL GERAL,101,81,4101507
2576341,HONPAR HOSPITAL NORTE PARANAENSE,HOSPITAL GERAL,397,349,4101507
2576430,HOSPITAL MUNICIPAL DE FAXINAL,HOSPITAL GERAL,30,30,4107603
2577240,UNIDADE MISTA SAO SEBASTIAO DA AMOREIRA,UNIDADE MISTA,25,25,4126009
2577283,HOSPITAL MUNICIPAL DE ASSAI,HOSPITAL GERAL,38,38,4101903
2577380,CEGEN,HOSPITAL GERAL,86,50,4106407
2577410,SANTA CASA DE BANDEIRANTES,HOSPITAL GERAL,136,109,4102406
2577429,HOSPITAL SAO LUCAS,HOSPITAL GERAL,37,0,4102406
2577445,ASSOCIACAO DE ASSISTENCIA A SAUDE DE SERTANEJA,HOSPITAL GERAL,23,23,4126405
