CNES,NOME ESTABELECIMENTO,DS_TIPO_UNIDADE,LEITOS EXISTENTE,LEITOS SUS,COD_MUN
2237881,HOSPITAL BANCO DE OLHOS DE PORTO ALEGRE,HOSPITAL ESPECIALIZADO,20,12,4314902
2238810,HOSPITAL SAO JACOB,HOSPITAL GERAL,32,20,4320305
2240335,HOSPITAL SAO CARLOS,HOSPITAL GERAL,112,71,4307906
2241013,HOSPITAL DE CARIDADE SAO ROQUE,HOSPITAL GERAL,50,35,4306452
2241021,HOSPITAL TACCHINI,HOSPITAL GERAL,283,133,4302105
2241048,HOSPITAL NOSSA SENHORA DA OLIVEIRA,HOSPITAL GERAL,157,95,4322509
2241056,UNIDADE MISTA DE SAUDE,UNIDADE MISTA,4,4,4309258
2241072,HOSPITAL SAO JOSE,HOSPITAL GERAL,51,35,4300802
2241102,HOSPITAL NOVA PETROPOLIS,HOSPITAL GERAL,39,31,4313201
2241129,HOSPITAL SAO PEDRO CANISIO,HOSPITAL GERAL,43,27,4302352
2241137,HOSPITAL SAO ROQUE,HOSPITAL GERAL,72,38,4304804
2241145,HOSPITAL FATIMA,HOSPITAL GERAL,53,35,4308201
2241153,HOSPITAL ARCANJO SAO MIGUEL,HOSPITAL GERAL,101,61,4309100
2241161,HOSPITAL SAO JOAO BATISTA,HOSPITAL GERAL,78,50,4313300
2241196,HOSPITAL CARLOS AUMOND UNIDADE MISTA,UNIDADE MISTA,10,10,4311122
2241218,HOSPITAL BENEFICENTE NOSSA SENHORA APARECIDA,HOSPITAL GERAL,40,30,4314001
2241226,HOSPITAL BENEFICENTE SAO JOAO BOSCO,HOSPITAL GERAL,75,45,4319000
2244098,HOSPITAL BERNARDINA SALLES DE BARROS,HOSPITAL GERAL,67,49,4311205
2244101,HOSPITAL DE CARIDADE SAO ROQUE,HOSPITAL GERAL,67,50,4308003
2244128,HOSPITAL NOSSA SENHORA DA PIEDADE,HOSPITAL GERAL,52,36,4313102
2244152,IRDESI DE JAGUARI,HOSPITAL GERAL,52,33,4311106
2244179,HOSPITAL DE IVORA,HOSPITAL GERAL,24,19,4310751
2244187,HOSPITAL DE MATA,HOSPITAL GERAL,28,21,4312104
2244209,CASA DE SAUDE SAO JOSE,HOSPITAL GERAL,30,18,4314472
2244217,HOSPITAL MUNICIPAL PEDRO CALIL,UNIDADE MISTA,27,27,4308409
2244225,HOSPITAL DE CARIDADE BRASILINA TERRA,HOSPITAL GERAL,73,53,4322202
2244233,HOSPITAL DE CARIDADE SAO FRANCISCO,HOSPITAL GERAL,51,43,4315503
2244276,HOSPITAL DE CARIDADE ASTROGILDO DE AZEVEDO,HOSPITAL GERAL,447,0,4316907
2244292,HOSPITAL SAO FRANCISCO DE ASSIS,HOSPITAL GERAL,68,0,4316907
2244306,HUSM HOSPITAL UNIVERSITARIO DE SANTA MARIA,HOSPITAL GERAL,394,370,4316907
2244314,HOSPITAL MUNICIPAL DE SAO PEDRO DO SUL,HOSPITAL GERAL,54,45,4319406
2244322,HOSPITAL SANTO ANTONIO,HOSPITAL GERAL,64,55,4319604
2244330,HOSPITAL SANTO ANTONIO,HOSPITAL GERAL,60,45,4318101
2244357,HOSPITAL DE CARIDADE DE SANTIAGO,HOSPITAL GERAL,132,110,4317400
2244365,HOSPITAL DA BASE AEREA,HOSPITAL GERAL,15,0,4316907
2244969,HOSPITAL DE OLHOS LIONS PASSO FUNDO,HOSPITAL ESPECIALIZADO,8,7,4314100
2245663,HOSPITAL SAO VICENTE DE PAULO,HOSPITAL GERAL,111,0,4314100
2246740,HOSPITAL SANTO ANTONIO,HOSPITAL GERAL,94,69,4320909
2246767,HOSPITAL SAO JOAO SANANDUVA,HOSPITAL GERAL,88,58,4316600
2246783,HOSPITAL ROQUE GONZALES TAPERA,HOSPITAL GERAL,35,22,4321006
2246791,HOSPITAL SAO JOSE,HOSPITAL GERAL,53,40,4318606
2246805,HOSPITAL SAO JOSE SERTAO,HOSPITAL GERAL,50,30,4320503
2246813,HOSPITAL NOTRE DAME SAO SEBASTIAO,HOSPITAL GERAL,95,77,4307500
2246872,HOSPITAL SANTA LUCIA CASCA,HOSPITAL GERAL,33,23,4304903
2246902,HOSPITAL NOTRE DAME JULIA BILLIART,HOSPITAL GERAL,51,36,4312658
2246910,HOSPITAL ALTO JACUI NAO ME TOQUE,HOSPITAL GERAL,50,33,4312658
2246929,HOSPITAL DE CLINICAS DE PASSO FUNDO,HOSPITAL GERAL,324,253,4314100
2246937,HOSPITAL SAO JOSE DAVID CANABARRO,HOSPITAL GERAL,32,24,4306304
2246953,HOSPITAL CRISTO REDENTOR MARAU,HOSPITAL GERAL,95,57,4311809
2246961,HOSPITAL FREI CLEMENTE SOLEDADE,HOSPITAL GERAL,118,78,4320800
2246988,HOSPITAL SAO VICENTE DE PAULO,HOSPITAL GERAL,649,479,4314100
2246996,HOSPITAL MUNICIPAL PASSO FUNDO,HOSPITAL GERAL,35,35,4314100
2247038,HOSPITAL SAO JOSE MAXIMILIANO DE ALMEIDA,HOSPITAL GERAL,40,38,4312203
2247046,HOSPITAL SANTA TEREZINHA PAIM FILHO,HOSPITAL GERAL,50,46,4313607
2247054,HOSPITAL PSIQUIATRICO BEZERRA DE MENEZES,HOSPITAL ESPECIALIZADO,82,50,4314100
2248190,SANTA CASA DE URUGUAIANA,HOSPITAL GERAL,255,198,4322400
2248204,SANTA CASA DE SAO GABRIEL,HOSPITAL GERAL,210,174,4318309
2248220,SANTA CASA DE MISERICORDIA,HOSPITAL GERAL,125,93,4317103
2248239,HOSPITAL AUXILIADORA,HOSPITAL GERAL,109,77,4316402
2248247,FUNDACAO HOSPITALAR DE CARIDADE DE QUARAI,HOSPITAL GERAL,62,51,4315305
2248271,HOSPITAL SAO PATRICIO DE ITAQUI,HOSPITAL GERAL,83,81,4310603
2248298,HOSPITAL INFANTIL,HOSPITAL GERAL,151,117,4318002
2248328,SANTA CASA DE ALEGRETE,HOSPITAL GERAL,200,153,4300406
2249472,HOSPITAL DE CARIDADE DE ERECHIM,HOSPITAL GERAL,102,1,4307005
2249499,HOSPITAL SAO ROQUE,HOSPITAL GERAL,31,26,4320602
2249502,ACHA ARATIBA,HOSPITAL GERAL,36,31,4300901
2249510,HOSPITAL SAO ROQUE DE GETULIO VARGAS,HOSPITAL GERAL,89,68,4308904
2249529,HOSPITAL MUNICIPAL DE CAMPINAS DO SUL,HOSPITAL GERAL,50,48,4303806
2249537,HOSPITAL N S DA POMPEIA VIADUTOS,HOSPITAL GERAL,52,35,4322905
2249545,HOSPITAL SANTA ISABEL,HOSPITAL GERAL,31,28,4308706
2249618,ASSOCIACAO HOSPITALAR MARCELINENSE,HOSPITAL GERAL,52,28,4311908
2249626,HOSPITAL SANTO ANTONIO ESTACAO,HOSPITAL GERAL,42,23,4307559
2249650,HOSPITAL MUNICIPAL SAO ROQUE,PRONTO SOCORRO GERAL,10,10,4310702
2249669,HOSPITAL UNIMED ERECHIM,HOSPITAL GERAL,22,0,4307005
2250675,HOSPITAL SANTO AFONSO,HOSPITAL GERAL,39,32,4304309
2250705,HOSPITAL DE CARIDADE BOA VISTA,HOSPITAL GERAL,40,27,4302204
2250713,HOSPITAL DE CARIDADE SAO PAULO SAO PAULO DAS MISSOES,HOSPITAL GERAL,36,25,4319307
2250772,HOSPITAL OSWALDO CRUZ,HOSPITAL GERAL,14,11,4309605
2250802,HOSPITAL CAMPINA,HOSPITAL GERAL,55,46,4303707
2250810,HOSPITAL SAO JOSE PORTO LUCENA RS,HOSPITAL GERAL,50,40,4315008
2250829,HOSPITAL DE CARIDADE DE SANTO CRISTO,HOSPITAL GERAL,56,41,4317905
2250837,HOSPITAL SAO VICENTE DE PAULO,HOSPITAL GERAL,76,48,4321808
2252007,HOSPITAL MARQUES DE SOUZA,HOSPITAL GERAL,41,31,4312054
2252023,HOSPITAL DE CARIDADE SANTANA BOM RETIRO DO SUL,HOSPITAL GERAL,50,33,4302402
2252058,HOSP DR ANUAR ELIAS AESSE BOQUEIRAO DO LEAO,HOSPITAL GERAL,40,32,4302451
2252066,HOSPITAL SAO JOSE SERIO,UNIDADE MISTA,10,10,4320453
2252074,HOSPITAL SAO GABRIEL ARCANJO,HOSPITAL GERAL,36,32,4306205
2252082,HOSPITAL SANTA ISABEL PROGRESSO,HOSPITAL GERAL,50,45,4315156
2252112,HOSPITAL SAO JOAO BATISTA NOVA BRESCIA,HOSPITAL GERAL,37,23,4313003
2252139,HOSPITAL BENEFICENTE LEONILDA BRUNET,HOSPITAL GERAL,40,24,4310306
2252147,SOCIEDADE BENEFICENTE ROQUE GONZALES,HOSPITAL GERAL,38,26,4315800
2252163,HOSPITAL BENEFICENTE SAO JOAO ARVOREZINHA,HOSPITAL GERAL,60,38,4301404
2252171,HOSPITAL DOUTOR OSCAR BENEVOLO,HOSPITAL GERAL,30,25,4315206
2252198,HOSPITAL SAO JOSE ARROIO DO MEIO,HOSPITAL GERAL,89,81,4301008
2252228,HOSPITAL SANTA TERESINHA ENCANTADO,HOSPITAL GERAL,57,35,4306809
2252244,HOSPITAL OURO BRANCO,HOSPITAL GERAL,84,69,4321451
2252260,HOSPITAL ESTRELA,HOSPITAL GERAL,150,107,4307807
2252287,HOSPITAL BRUNO BORN,HOSPITAL GERAL,201,136,4311403
2252295,SOCIEDADE PORTUGUESA DE BENEFICENCIA,HOSPITAL GERAL,239,144,4314407
2252341,HOSPITAL MIGUEL PILTCHER,HOSPITAL GERAL,34,0,4314407
2252376,HOSPITAL ESPIRITA DE PELOTAS,HOSPITAL ESPECIALIZADO,199,160,4314407
2252694,HOSPITAL ESCOLA DA UNIVERSIDADE FEDERAL DE PELOTAS,HOSPITAL GERAL,180,175,4314407
2253046,UCPEL HOSPITAL UNIVERSITARIO SAO FRANCISCO DE PAULA,HOSPITAL GERAL,276,211,4314407
2253054,SANTA CASA DE MISERICORDIA DE PELOTAS,HOSPITAL GERAL,270,180,4314407
2253690,CLINICANP,HOSPITAL GERAL,40,0,4314407
2254611,HOSPITAL VIDA SAUDE,HOSPITAL GERAL,160,110,4317202
2254956,HOSPITAL PANAMBI,HOSPITAL GERAL,59,37,4313904
2254964,HOSPITAL SANTA CRUZ,HOSPITAL GERAL,232,142,4316808
2255928,HOSPITAL MONTE ALVERNE,HOSPITAL GERAL,35,26,4316808
2255936,HOSPITAL ANA NERY,HOSPITAL GERAL,81,49,4316808
2257467,HOSPITAL DR OSWALDO DIESEL,HOSPITAL GERAL,75,65,4321709
2257548,HOSPITAL NOSSA SENHORA APARECIDA DE CAMAQUA,HOSPITAL GERAL,0,0,4303509
2257556,HOSPITAL MONTENEGRO,HOSPITAL GERAL,150,150,4312401
2257564,FUNDACAO HOSPITALAR DE ROLANTE,HOSPITAL GERAL,52,50,4316006
2257572,HOSPITAL NOSSA SENHORA DO CARMO,HOSPITAL GERAL,50,40,4321105
2257645,HOSPITAL SAO PEDRO,HOSPITAL GERAL,77,50,4308607
2257815,HOSPITAL SAO VICENTE DE PAULO,HOSPITAL GERAL,92,64,4313508
2259850,HOSPITAL ROQUE GONZALES CAIBATE,HOSPITAL GERAL,41,31,4303301
2259869,HOSPITAL DE CARIDADE SERRO AZUL,HOSPITAL GERAL,55,34,4305207
2259877,HOSPITAL SAO MIGUEL ARCANJO,HOSPITAL GERAL,39,31,4319158
2259893,HOSPITAL SAO LUIZ GONZAGA,HOSPITAL GERAL,131,101,4318903
2259907,HOSPITAL SANTO ANGELO,HOSPITAL GERAL,202,156,4317509
2259931,HOSPITAL SANTA TERESA GUARANI DAS MISSOES,HOSPITAL GERAL,45,36,4309506
2259974,HOSPITAL SANTO ANTONIO ROQUE GONZALES,HOSPITAL GERAL,37,34,4316303
2259982,HOSPITAL DE PORTO XAVIER,HOSPITAL GERAL,51,32,4315107
2260050,HOSPITAL NOSSA SENHORA DO ROSARIO,HOSPITAL GERAL,55,36,4320404
2260069,HOSPITAL SAO JOSE,HOSPITAL GERAL,50,36,4309001
2261030,HOSPITAL BOM PASTOR IJUI,HOSPITAL GERAL,80,58,4310207
2261057,HOSPITAL DE CARIDADE DE IJUI,HOSPITAL GERAL,238,157,4310207
2261065,HOSPITAL BOM PASTOR,HOSPITAL GERAL,85,63,4317806
2261081,HOSPITAL SAO FRANCISCO,HOSPITAL GERAL,50,36,4301503
2261103,HOSPITAL DE CHIAPETTA,HOSPITAL GERAL,31,26,4305405
2261111,HOSPITAL DE CONDOR,HOSPITAL GERAL,26,26,4305702
2261138,HOSPITAL PEJUCARA,HOSPITAL GERAL,17,16,4314308
2261154,HCN,HOSPITAL GERAL,36,35,4304002
2261987,SANTA CASA DE CARIDADE DE BAGE,HOSPITAL GERAL,220,156,4301602
2261995,HOSPITAL UNIVERSITARIO URCAMP,HOSPITAL GERAL,60,50,4301602
2262002,HOSPITAL SAO LUIZ,HOSPITAL GERAL,130,79,4306601
2262010,HOSPITAL DA COLONIA NOVA,HOSPITAL GERAL,42,34,4300034
2262029,FUNDACAO MEDICO HOSPITALAR,HOSPITAL GERAL,32,29,4311502
2262274,HOSPITAL COMUNITARIO DE CARAZINHO,HOSPITAL GERAL,147,102,4304705
2262568,HOSPITAL SAO LUCAS DA PUCRS,HOSPITAL GERAL,591,319,4314902
2263823,HOSPITAL SANTA LUCIA LTDA,HOSPITAL GERAL,83,0,4306106
2263831,ASSOCIACAO HOSPITALAR 15 DE NOVEMBRO,HOSPITAL GERAL,19,14,4315354
2263858,HOSPITAL DE CARIDADE SAO VICENTE DE PAULO,HOSPITAL GERAL,195,151,4306106
2263866,HOSPITAL MUNICIPAL BOM PASTOR,HOSPITAL GERAL,24,21,4308458
2263874,HOSPITAL MUNICIPAL SALDANHA MARINHO,HOSPITAL GERAL,19,16,4316436
2263882,HOSPITAL MUNICIPAL DR ADERBAL SCHNEIDER,HOSPITAL GERAL,32,23,4316451
2263890,HOSPITAL SANTA BARBARA BENEFICENTE,HOSPITAL GERAL,51,41,4316709
2265052,HOSPITAL FEMINA,HOSPITAL ESPECIALIZADO,166,166,4314902
2265060,HOSPITAL CRISTO REDENTOR,HOSPITAL ESPECIALIZADO,255,237,4314902
2265885,HOSPITAL AJURICABA,HOSPITAL GERAL,50,40,4300208
2265893,HOSPITAL ADESCO,HOSPITAL GERAL,32,29,4309704
2265958,HOSPITAL DE BUTIA,HOSPITAL GERAL,31,31,4302709
2266474,HOSPITAL DE CARIDADE E BENEFICENCIA,HOSPITAL GERAL,203,123,4303004
2266733,HOSPITAL MUNICIPAL CONDE MODESTO LEAL,HOSPITAL GERAL,102,102,3302700
2267187,HOSPITAL FLAVIO LEAL,HOSPITAL GERAL,61,52,3304003
2267209,HOSPITAL MUNICIPAL MARIANA MARIA DE JESUS,HOSPITAL GERAL,82,82,3304151
2267454,HOSPITAL MUNICIPAL AUGUSTINHO GESUALD BLANC,HOSPITAL GERAL,35,35,3300159
2267713,HOSPITAL DE CANTAGALO,HOSPITAL GERAL,93,71,3301108
2267802,HOSPITAL GERAL DE ARRAIAL DO CABO,HOSPITAL GERAL,91,91,3300258
2267810,HOSPITAL SANTO ANTONIO,HOSPITAL GERAL,16,16,3301603
2268051,HOSPITAL MUNICIPAL DR JOAO PEREIRA MARTINS,HOSPITAL GERAL,25,25,3305703
2268329,HOSPITAL GERAL DR LUIZ PINTO,HOSPITAL GERAL,21,21,3304508
2268922,HOSPITAL MUNICIPAL DESEMBARGADOR LEAL JUNIOR HMDLJ,HOSPITAL GERAL,154,149,3301900
2269341,SMS RIO HOSPITAL MUNICIPAL JESUS,HOSPITAL ESPECIALIZADO,100,97,3304557
2269384,HOSPITAL FEDERAL DO ANDARAI,HOSPITAL GERAL,273,263,3304557
2269392,POLICLINICA PIQUET CARNEIRO,HOSPITAL GERAL,9,9,3304557
2269430,UFRJ INSTITUTO DE PSIQUIATRIA DA UFRJ IPUB,HOSPITAL ESPECIALIZADO,192,192,3304557
2269481,SMS HOSPITAL MUNICIPAL DA PIEDADE AP 32,HOSPITAL GERAL,139,139,3304557
2269678,SES RJ IECAC INST EST DE CARDIOLOGIA ALOYSIO DE CASTRO,HOSPITAL ESPECIALIZADO,101,90,3304557
2269724,SMS HOSPITAL MUNICIPAL NOSSA SENHORA DO LORETO AP 31,HOSPITAL ESPECIALIZADO,36,36,3304557
2269775,MS HOSPITAL DE IPANEMA,HOSPITAL GERAL,133,133,3304557
2269783,UERJ HOSPITAL UNIV PEDRO ERNESTO,HOSPITAL GERAL,431,406,3304557
2269821,MS INCA II HOSPITAL DO CANCER II,HOSPITAL ESPECIALIZADO,83,83,3304557
2269880,MS HGB HOSPITAL GERAL DE BONSUCESSO,HOSPITAL GERAL,434,386,3304557
2269899,HOSPITAL MARIO KROEFF,HOSPITAL ESPECIALIZADO,79,65,3304557
2269945,SMS RIO HOSPITAL MATERNIDADE ALEXANDER FLEMING,HOSPITAL ESPECIALIZADO,93,93,3304557
2269988,MS HSE HOSPITAL DOS SERVIDORES DO ESTADO,HOSPITAL GERAL,407,407,3304557
2269996,SMS IMAS JULIANO MOREIRA AP 40,HOSPITAL ESPECIALIZADO,160,160,3304557
2270021,MATERNIDADE ESCOLA DA UFRJ,HOSPITAL ESPECIALIZADO,81,81,3304557
2270056,SMS HOSPITAL MUNICIPAL PAULINO WERNECK AP 31,HOSPITAL GERAL,30,30,3304557
2270161,SEAP CGSP RJ HOSP DR HAMILTON AGOSTINHO VIEIRA CASTRO,PRONTO SOCORRO GERAL,76,70,3304557
2270196,SEAP CGSP RJ SANATORIO PENAL,HOSPITAL GERAL,112,109,3304557
2270234,SESDEC RJ HOSPITAL ESTADUAL GETULIO VARGAS,HOSPITAL GERAL,297,287,3304557
2270242,SMS HOSPITAL MUNICIPAL BARATA RIBEIRO AP 1 0,HOSPITAL ESPECIALIZADO,122,122,3304557
2270269,SMS HOSPITAL MUNICIPAL MIGUEL COUTO AP 21,HOSPITAL GERAL,319,314,3304557
2270390,SMS HOSPITAL MATERNIDADE HERCULANO PINHEIRO AP 33,HOSPITAL ESPECIALIZADO,69,60,3304557
2270609,SMS HOSPITAL MUNICIPAL LOURENCO JORGE AP 40,HOSPITAL GERAL,242,242,3304557
2270617,INSTITUTO ESTADUAL DE DERMATOLOGIA SANITARIA,HOSPITAL GERAL,77,77,3304557
2270668,UFRJ HOSP ESCOLA SAO FRANCISCO DE ASSIS,HOSPITAL GERAL,1,0,3304557
2270692,CBMERJ HOSP ARISTARCHO PESSOA HOSP DO CORPO DE BOMBEIROS,HOSPITAL GERAL,80,0,3304557
2270714,SMS RIO HOSPITAL MATERNIDADE FERNANDO MAGALHAES,HOSPITAL ESPECIALIZADO,156,156,3304557
2270803,SES RJ I INST EST DIABET ENDOCRINOLOGIA IEDE,HOSPITAL ESPECIALIZADO,26,26,3304557
2271141,HOSPITAL MUNICIPAL DE PINHEIRAL AURELINO GONCALVES BARBOSA,HOSPITAL GERAL,32,30,3303955
2271443,CASA DE SAUDE SAO JOSE,HOSPITAL GERAL,209,0,3304557
2271826,HOSPITAL MATERNIDADE DOUTOR MARIO DUTRA DE CASTRO,HOSPITAL ESPECIALIZADO,51,45,3303401
2272210,UNIDADE DE ATENDIMENTO DR ANTONIO MONTEIRO,UNIDADE MISTA,1,1,3304102
2272601,HOSPITAL NOSSA SENHORA DO CARMO,HOSPITAL GERAL,42,40,3301207
2272695,HOSPITAL SAO LUCAS,HOSPITAL GERAL,103,16,3303401
2272784,HOSPITAL MUNICIPAL RAUL SERTA,HOSPITAL GERAL,216,209,3303401
2273098,HOSPITAL SAO SILVESTRE,HOSPITAL GERAL,29,0,3300209
2273101,HOSPITAL SAO LUCAS,HOSPITAL GERAL,34,34,3304128
2273187,SMS HOSPITAL MUNICIPAL ALVARO RAMOS AP 40,HOSPITAL ESPECIALIZADO,48,48,3304557
2273209,SES RJ HOSPITAL ESTADUAL SANTA MARIA,HOSPITAL ESPECIALIZADO,93,93,3304557
2273276,MS INST NACIONAL DE TRAUMATOLOGIA E ORTOPEDIA JAMIL HADDAD,HOSPITAL ESPECIALIZADO,332,331,3304557
2273349,SMS RIO HOSPITAL RAPHAEL DE PAULA SOUZA,HOSPITAL GERAL,35,35,3304557
2273357,HOSPITAL ADVENTISTA SILVESTRE,HOSPITAL GERAL,126,32,3304557
2273365,SES RJ INSTITUTO ESTADUAL DE INFECTOLOGIA SAO SEBASTIAO,HOSPITAL GERAL,14,13,3304557
2273381,SMS HOSPITAL MUNICIPAL JURANDYR MANFREDINI AP 40,HOSPITAL ESPECIALIZADO,40,40,3304557
2273411,SES RJ HOSPITAL ESTADUAL CARLOS CHAGAS,HOSPITAL GERAL,202,172,3304557
2273438,HOSPITAL CENTRAL DA POLICIA MILITAR DO ESTADO DO RIO DE JANE,HOSPITAL GERAL,200,0,3304557
2273454,MS INCA HOSPITAL DO CANCER I,HOSPITAL ESPECIALIZADO,204,204,3304557
2273462,MS INCA HOSPITAL DO CANCER III,HOSPITAL ESPECIALIZADO,108,108,3304557
2273489,SMS RIO HOSPITAL MUNICIPAL ROCHA MAIA,HOSPITAL GERAL,23,23,3304557
2273497,FUNDACAO BELA LOPES DE OLIVEIRA,HOSPITAL GERAL,70,0,3304557
2273519,HOSPITAL EVANGELICO,HOSPITAL GERAL,28,0,3304557
2273659,MS HOSPITAL FEDERAL DA LAGOA,HOSPITAL GERAL,213,213,3304557
2273748,HUV HOSPITAL UNIVERSITARIO DE VASSOURAS,HOSPITAL GERAL,252,228,3306206
2273756,HOSPITAL EUFRASIA TEIXEIRA LEITE,HOSPITAL GERAL,127,87,3306206
2273780,CASA DE SAUDE CANANEIA,HOSPITAL ESPECIALIZADO,138,138,3306206
2274108,POLICLINICA MUNICIPAL AGUINALDO MORAES,HOSPITAL GERAL,40,40,3305604
2274299,HOSPITAL MUNICIPAL NOSSA SENHORA DE NAZARETH,HOSPITAL GERAL,71,71,3305505
2275228,CASA DE SAUDE SANTA MONICA,HOSPITAL GERAL,55,5,3304706
2275244,CASA DE SAUDE PIO XII,HOSPITAL GERAL,46,1,3304706
2275562,HOSPITAL ALCIDES CARNEIRO,HOSPITAL GERAL,242,232,3303906
2275589,HOSPITAL MUNICIPAL DR NELSON DE SA EARP,HOSPITAL GERAL,111,60,3303906
2275600,HSM,HOSPITAL ESPECIALIZADO,160,160,3303906
2275619,H C C,HOSPITAL ESPECIALIZADO,282,252,3303906
2275627,SANATORIO OSWALDO CRUZ LTDA,HOSPITAL GERAL,456,344,3303906
2275635,HOSPITAL SANTA TERESA,HOSPITAL GERAL,165,64,3303906
2276186,HOSPITAL NOSSA SENHORA DA PIEDADE,HOSPITAL GERAL,66,55,3303708
2276267,HOSPITAL NATIVIDADE,HOSPITAL GERAL,53,49,3303104
2277174,HOSPITAL NELSON SALLES,HOSPITAL GERAL,32,23,3301801
2277301,SMS CMS MANOEL ARTHUR VILLABOIM AP 10,UNIDADE MISTA,8,8,3304557
2277581,POSTO MEDICO SANITARIO DE XEREM,PRONTO SOCORRO GERAL,13,13,3301702
2277611,POSTO MEDICO SANITARIO DE IMBARIE,PRONTO SOCORRO GERAL,9,9,3301702
2277662,POSTO MEDICO SANITARIO DE CAMPOS ELISEOS,PRONTO SOCORRO GERAL,5,5,3301702
2277700,CRAIS SARACURUNA,PRONTO SOCORRO GERAL,15,15,3301702
2277719,POSTO MEDICO SANITARIO PARQUE EQUITATIVA,PRONTO SOCORRO GERAL,16,16,3301702
2277743,POSTO MEDICO SANITARIO DO PILAR,PRONTO SOCORRO GERAL,10,10,3301702
2277751,HOSPITAL INFANTIL ISMELIA SILVEIRA,HOSPITAL ESPECIALIZADO,57,57,3301702
2278138,HOSPITAL MUNICIPAL OTIME CARDOSO DOS SANTOS,HOSPITAL GERAL,41,41,3300704
2278162,CLINICA SAO MIGUEL,HOSPITAL GERAL,68,49,3300704
2278170,CLINICA SANTA HELENA,HOSPITAL GERAL,104,25,3300704
2278189,HOSPITAL CENTRAL DE EMERGENCIA,PRONTO SOCORRO GERAL,12,12,3300704
2278278,HOSPITAL MUNICIPAL DE TAMOIOS,HOSPITAL GERAL,32,32,3300704
2278286,HOSPITAL SANTA IZABEL,HOSPITAL GERAL,70,45,3300704
2278324,HOSPITAL MUNICIPAL DE PIABETA,HOSPITAL GERAL,57,57,3302502
2278332,HOSPITAL MUNICIPAL DE MAGE,HOSPITAL GERAL,64,61,3302502
2278456,HOSPITAL MUNICIPAL DE STO ALEIXO DR WALTER MORAES DE ARRUDA,PRONTO SOCORRO GERAL,30,10,3302502
2278855,HOSPITAL SAO JOSE DO AVAI,HOSPITAL GERAL,358,212,3302205
2278901,CLINICA SAO CAMILO DE LELIS LTDA,HOSPITAL GERAL,8,6,3302205
2279355,HOSPITAL MUNICIPAL DR ADALBERTO DA GRACA,HOSPITAL GERAL,54,54,3303609
2279525,CASA DE SAUDE PARACAMBI,HOSPITAL GERAL,28,0,3303609
2280051,SANTA CASA DE MISERICORDIA DE BARRA MANSA,HOSPITAL GERAL,218,153,3300407
2280132,MS INC INSTITUTO NACIONAL DE CARDIOLOGIA,HOSPITAL ESPECIALIZADO,221,150,3304557
2280167,HOSPITAL UNIVERSITARIO CLEMENTINO FRAGA FILHO,HOSPITAL GERAL,364,304,3304557
2280183,HOSPITAL MUNICIPAL SOUZA AGUIAR,HOSPITAL GERAL,372,372,3304557
2280248,SMS MATERNIDADE CARMELA DUTRA AP 32,HOSPITAL ESPECIALIZADO,119,119,3304557
2280396,HOSPITAL MUNICIPAL ANGELA MARIA SIMOES MENEZES,HOSPITAL GERAL,84,83,3301306
2280477,HOSPITAL E MATERNIDADE DA ALDEIA,HOSPITAL GERAL,49,33,3305208
2280582,PRONTO SOCORRO MUNICIPAL DR JOSE SEVE NETO,PRONTO SOCORRO GERAL,13,13,3305208
2280728,SMS RIO INSTITUTO MUNICIPAL NISE DA SILVEIRA AP 32,HOSPITAL ESPECIALIZADO,93,93,3304557
2280868,HOSPITAL E MATERNIDADE CODRATO DE VILHENA,HOSPITAL GERAL,131,109,3300100
2281287,HOSPITAL UNIMED VOLTA REDONDA UNIDADE LITORAL,HOSPITAL GERAL,46,0,3300100
2281384,HOSPITAL DE PRAIA BRAVA,HOSPITAL GERAL,40,21,3300100
2282097,PRONTONIL,HOSPITAL ESPECIALIZADO,276,0,3303500
2282801,HOSPITAL DR CELSO ERTHAL,HOSPITAL GERAL,67,62,3300506
2283239,HOSPITAL MUNICIPAL LUIZ GONZAGA,HOSPITAL GERAL,102,102,3302908
2283328,HOSPITAL ARMANDO VIDAL,HOSPITAL GERAL,123,111,3304805
2283395,HOSPITAL SAO JOSE OPERARIO,HOSPITAL GERAL,58,58,3300704
2283697,CLINICA DE REPOUSO EGO,HOSPITAL ESPECIALIZADO,200,29,3305752
2283794,HOSPITAL MUNICIPAL MOACYR GOMES DE AZEVEDO,HOSPITAL GERAL,50,48,3300902
2283832,HOSPITAL DAS CLINICAS DE JUSCELINO,HOSPITAL GERAL,76,0,3302858
2284634,HOSPITAL MUNICIPAL SAO FRANCISCO XAVIER,HOSPITAL GERAL,90,90,3302007
2285150,HOSPITAL DE SAO VICENTE,HOSPITAL GERAL,35,35,3300209
2285916,CASA DE SAUDE E MATERNIDADE SAO SEBASTIAO,HOSPITAL GERAL,30,15,3303005
2285932,HOSPITAL DE MIRACEMA,HOSPITAL GERAL,53,36,3303005
2285975,HOSPITAL MUNICIPAL NOSSA SENHORA DAS DORES,HOSPITAL GERAL,21,21,3300225
2286289,SANTA CASA DE MISERICORDIA DE SAO JOAO DA BARRA,HOSPITAL GERAL,40,40,3305000
2287250,SOCIEDADE PORTUGUESA DE BENEFICENCIA DE CAMPOS,HOSPITAL GERAL,248,166,3301009
2287285,HOSPITAL DR BEDA,HOSPITAL GERAL,129,60,3301009
2287382,SANTA CASA DE MISERICORDIA DE CAMPOS,HOSPITAL GERAL,536,338,3301009
2287447,HOSPITAL ESCOLA ALVARO ALVIM,HOSPITAL GERAL,153,113,3301009
2287579,HOSPITAL FERREIRA MACHADO,HOSPITAL GERAL,238,218,3301009
2287919,CASA DE CARIDADE SANTA RITA,HOSPITAL GERAL,106,85,3300308
2287927,HOSPITAL E MATERNIDADE MARIA DE NAZARE,HOSPITAL GERAL,75,58,3300308
2288001,CLINICA ANTONIO FRANCISCO,HOSPITAL GERAL,4,0,3300308
2288109,HOSPITAL MUNICIPAL VICTOR DE SOUZA BREVES,HOSPITAL GERAL,62,62,3302601
2288230,HOSP MUNICIPAL MATERNIDADE DR MANOEL MARTINS DE BARROS,HOSPITAL GERAL,36,36,3302254
2288338,INI FIOCRUZ,HOSPITAL ESPECIALIZADO,31,31,3304557
2288362,SMS INSTITUTO MUNICIPAL PHILIPPE PINEL AP 21,HOSPITAL ESPECIALIZADO,74,74,3304557
2288885,SANTA CASA DE MISERICORDIA DE RESENDE,HOSPITAL GERAL,79,70,3304201
2288893,HOSPITAL MUNICIPAL HENRIQUE SERGIO GREGORI,HOSPITAL GERAL,75,73,3304201
2288907,APMIR,HOSPITAL ESPECIALIZADO,59,39,3304201
2289377,INTENSIBARRA,HOSPITAL ESPECIALIZADO,20,0,3300407
2289571,HOSPITAL MUNICIPAL DE BELFORD ROXO,HOSPITAL GERAL,40,40,3300456
2289709,HOSPITAL DE CLINICAS BELFORD ROXO,HOSPITAL GERAL,91,0,3300456
2290073,HOSPITAL MUNICIPAL ANA MOREIRA,HOSPITAL GERAL,36,36,3301405
2290227,SES RJ HOSPITAL ESTADUAL ADAO PEREIRA NUNES,HOSPITAL GERAL,326,290,3301702
2290499,HOSPITAL MUNICIPAL DE LAJE DO MURIAE,HOSPITAL GERAL,30,30,3302304
2291266,SMS RIO HOSPITAL MUNICIPAL FRANCISCO DA SILVA TELLES,HOSPITAL GERAL,63,63,3304557
2291282,SCMRJ SANTA CASA HOSPITAL N S DAS DORES,HOSPITAL GERAL,234,120,3304557
2291304,SESDEC RJ CENTRO PSIQUIATRICO RIO DE JANEIRO,HOSPITAL ESPECIALIZADO,108,108,3304557
2291320,HOSPITAL MUNICIPAL MANOEL CAROLA,HOSPITAL GERAL,30,30,3304755
2291525,OFTALMOCLINICA SAO GONCALO,HOSPITAL GERAL,13,13,3304904
2292084,HOSPITAL DE CAMPANHA COVID 19 LUIZ PALMIER,HOSPITAL GERAL,154,124,3304904
2292270,HOSPITAL MUNICIPAL MATERNIDADE SANTA THERESINHA,HOSPITAL GERAL,57,55,3305158
2292386,HOSPITAL SAO JOSE,HOSPITAL GERAL,147,74,3305802
2292513,BENEFICENCIA PORTUGUESA DE TERESOPOLIS,HOSPITAL GERAL,105,81,3305802
2292661,CLINICA DE REPOUSO TRES RIOS,HOSPITAL ESPECIALIZADO,172,120,3306008
2292912,HOSPITAL ESCOLA LUIZ GIOSEFFI JANNUZZI,HOSPITAL GERAL,228,228,3306107
2293382,CLINICA DE REPOUSO SANTA LUCIA LTDA,HOSPITAL ESPECIALIZADO,208,160,3303401
2294923,HOSPITAL DE CLINICAS NOSSA SENHORA DA CONCEICAO,HOSPITAL GERAL,98,69,3306008
2295016,CASA DE SAUDE JOAO XXIII LTDA,HOSPITAL GERAL,33,0,3302106
2295067,INSTITUTO ESTADUAL DE HEMATOLOGIA ARTHUR SIQUEIRA CAVALCANTI,HOSPITAL ESPECIALIZADO,83,83,3304557
2295075,HOSPITAL GUSTAVO MONTEIRO JUNIOR,HOSPITAL GERAL,51,40,3306107
2295105,HOSPITAL SANTA ISABEL,HOSPITAL GERAL,40,40,3306107
2295113,IRMANDADE DA SANTA CASA DA MISERICORDIA DE VALENCA,HOSPITAL GERAL,12,12,3306107
2295369,ACAO CRISTA VICENTE MORETTI,HOSPITAL ESPECIALIZADO,50,40,3304557
2295407,SMS HOSPITAL MUNICIPAL ROCHA FARIA AP 52,HOSPITAL GERAL,205,175,3304557
2295415,HOSPITAL UNIVERSITARIO GAFFREE E GUINLE,HOSPITAL GERAL,237,233,3304557
2295423,MS HOSPITAL FEDERAL CARDOSO FONTES,HOSPITAL GERAL,176,149,3304557
2296241,HOSPITAL REGIONAL DARCY VARGAS,HOSPITAL GERAL,117,93,3304300
2296306,SMS RIO HOSPITAL MUNICIPAL SALGADO FILHO,HOSPITAL GERAL,308,308,3304557
2296594,UFRJ INSTITUTO DE GINECOLOGIA,HOSPITAL ESPECIALIZADO,12,12,3304557
2296608,HCJ HOSPITAL DE CLINICAS DE JACAREPAGUA,HOSPITAL GERAL,110,0,3304557
2296616,UFRJ IPPMG INST DE PUER PED MARTAGAO GESTEIRA,HOSPITAL ESPECIALIZADO,76,76,3304557
2296705,UNIDADE MISTA DO LOTE XV,UNIDADE MISTA,17,17,3300456
2296764,CASA DE SAUDE E MATERNIDADE NOSSA SENHORA DA GLORIA,HOSPITAL ESPECIALIZADO,40,3,3300456
2296977,CASA DE SAUDE SANTA MARIA SA,HOSPITAL GERAL,34,0,3300407
2297132,HOSPITAL INFANTIL 21 DE JULHO LTDA,HOSPITAL ESPECIALIZADO,67,67,3304144
2297434,HOSPITAL SAO JOSE DOS LIRIOS,HOSPITAL GERAL,87,0,3304904
2297442,CASA DE SAUDE SANTA LUCIA LTDA,HOSPITAL GERAL,67,0,3304904
2297450,CLINICA SANTA CATARINA,HOSPITAL ESPECIALIZADO,120,0,3304904
2297485,CLIMEP,HOSPITAL ESPECIALIZADO,11,0,3304904
2297515,CLINICA NOSSA SENHORA DAS VITORIAS,HOSPITAL ESPECIALIZADO,211,211,3304904
2297566,HOSPITAL FRANCISCANO NOSSA SENHORA DAS GRACAS,HOSPITAL GERAL,72,64,3304904
2297590,MATERNIDADE MUNICIPAL DR MARIO NIAJAR,HOSPITAL GERAL,100,100,3304904
2297795,HOSPITAL DAS CLINICAS DE TERESOPOLIS,HOSPITAL GERAL,193,137,3305802
2297833,CLINICA SAO VICENTE,HOSPITAL GERAL,97,0,3304557
2298031,SES RJ HOSPITAL ESTADUAL ALBERTO TORRES GERAL SAO GONCALO,HOSPITAL GERAL,241,230,3304904
2298090,HOSPITAL UNIMED DE NOVA FRIBURGO,HOSPITAL GERAL,103,0,3303401
2298104,HOSPITAL SERRANO,HOSPITAL GERAL,41,0,3303401
2298120,SMS HOSPITAL MUNICIPAL ALBERT SCHWEITZER AP 51,HOSPITAL GERAL,396,294,3304557
2298317,HOSPITAL DOS PLANTADORES DE CANA,HOSPITAL GERAL,220,180,3301009
2298708,POSTO DE ASSISTENCIA MEDICA DR ABDON GONCALVES,PRONTO SOCORRO GERAL,30,30,3305109
2298724,SES RJ HOSPITAL ESTADUAL ANCHIETA,HOSPITAL GERAL,135,60,3304557
2298740,HOSPITAL CLINICA GRAJAU,HOSPITAL GERAL,47,0,3304557
2299143,MEMORIAL FATIMA OLADEJO HOSPITAL,HOSPITAL GERAL,11,0,3304201
2299216,SAMER HOSPITAL,HOSPITAL GERAL,104,2,3304201
2299569,HOSPITAL SANTO ANTONIO IMAS,HOSPITAL GERAL,28,21,4218103
2299836,HOSPITAL SAO ROQUE,HOSPITAL GERAL,45,36,4208708
2300184,HOSPITAL SAO ROQUE DE LUZERNA,HOSPITAL GERAL,63,58,4210035
2300435,HOSPITAL FREI ROGERIO,HOSPITAL GERAL,33,30,4201000
2300478,HOSPITAL FAUSTINO RISCAROLLI,HOSPITAL GERAL,33,23,4204558
2300486,HOSPITAL SANTA CLARA,HOSPITAL GERAL,50,44,4211751
2300516,HOSPITAL DE CARIDADE CORACAO DE JESUS,HOSPITAL GERAL,132,102,4216503
2300850,FUNDACAO MEDICO SOCIAL RURAL DE PONTE ALTA,HOSPITAL GERAL,26,26,4213302
2300885,HOSPITAL SAO JOSE DE URUBICI,HOSPITAL GERAL,48,39,4218905
2301296,HOSPITAL SOBRASA,HOSPITAL GERAL,71,0,2931350
2301318,HOSPITAL MUNICIPAL DE TEIXEIRA DE FREITAS,HOSPITAL GERAL,158,148,2931350
2301504,CLINICA SAO LUCAS,UNIDADE MISTA,7,0,2931350
2301601,HOSPITAL GONCALVES MARTINS,HOSPITAL GERAL,50,50,2922508
